{"alfworld_version":"0.4.2","asynchronous":false,"auto_reset":false,"batch_size":1,"env_infos":["won","admissible_commands","extra.gamefile"],"gym_version":"0.26.2","manifest_id":"ALFWORLD_ENVIRONMENT_RUNTIME_MANIFEST_V1","max_episode_steps":31,"process_start_method":"spawn","python_executable_sha256":"63ee2d15bcc51d8ef275e93e083463f7e4e77d4079a1c7d0884efae3ebb88e55","python_version":"3.12.13","schema_id":"ALFWORLD_ENVIRONMENT_RUNTIME_MANIFEST_V1","schema_version":1,"source_identities":[{"logical_name":"AlfredTWEnv","sha256":"4d9166363e32f0fa70c63530a900785ddb45c79387a02ebcb9a21252869a8924","source_path":"/data/run01/scwb204/sdar_repro/conda_envs/sdar_sft_py312/lib/python3.12/site-packages/alfworld/agents/environment/alfred_tw_env.py"},{"logical_name":"AlfredDemangler","sha256":"4d9166363e32f0fa70c63530a900785ddb45c79387a02ebcb9a21252869a8924","source_path":"/data/run01/scwb204/sdar_repro/conda_envs/sdar_sft_py312/lib/python3.12/site-packages/alfworld/agents/environment/alfred_tw_env.py"},{"logical_name":"AlfredInfos","sha256":"4d9166363e32f0fa70c63530a900785ddb45c79387a02ebcb9a21252869a8924","source_path":"/data/run01/scwb204/sdar_repro/conda_envs/sdar_sft_py312/lib/python3.12/site-packages/alfworld/agents/environment/alfred_tw_env.py"},{"logical_name":"textworld.gym.register_games","sha256":"900eb8681015293f7c4b0f80049c49b6c8e84e1cc0ca70af828fb097e40d0785","source_path":"/data/run01/scwb204/sdar_repro/conda_envs/sdar_sft_py312/lib/python3.12/site-packages/textworld/gym/utils.py"}],"textworld_version":"1.7.0","wrapper_order":["AlfredDemangler(shuffle=false)","AlfredInfos"]}
